Sheet: UI
B2: Tuning A
B3: Num | C3: Freq | D3: Gain | E3: Q
B4: 1 | C4: 1000 | D4: 5.5 | E4: 2.45
B5: of:=[.B4]+1 -> 2 | C5: 1000 | D5: 5.5 | E5: 2
B6: of:=[.B5]+1 -> 3 | C6: 1000 | D6: 5.5 | E6: 2
B7: of:=[.B6]+1 -> 4 | C7: 1000 | D7: 5.5 | E7: 2
B8: of:=[.B7]+1 -> 5 | C8: 1000 | D8: 5.5 | E8: 2
B9: of:=[.B8]+1 -> 6 | C9: 1000 | D9: 5.5 | E9: 2
B10: of:=[.B9]+1 -> 7 | C10: 1000 | D10: 5 | E10: 2
B11: of:=[.B10]+1 -> 8 | C11: 1000 | D11: 5.5 | E11: 2
B12: of:=[.B11]+1 -> 9 | C12: 1000 | D12: 5.5 | E12: 2
B13: of:=[.B12]+1 -> 10 | C13: 1000 | D13: 5.5 | E13: 2
B14: of:=[.B13]+1 -> 11 | C14: 1000 | D14: 5.5 | E14: 2
B15: of:=[.B14]+1 -> 12 | C15: 1000 | D15: 5.5 | E15: 2
B16: of:=[.B15]+1 -> 13 | C16: 1000 | D16: 5.5 | E16: 2
B17: of:=[.B16]+1 -> 14 | C17: 1000 | D17: 5.5 | E17: 2
B18: of:=[.B17]+1 -> 15 | C18: 1000 | D18: 5.5 | E18: 2
B19: of:=[.B18]+1 -> 16 | C19: 1000 | D19: 5.5 | E19: 2
B20: of:=[.B19]+1 -> 17 | C20: 1000 | D20: 5.5 | E20: 2
B21: of:=[.B20]+1 -> 18 | C21: 1000 | D21: 5.5 | E21: 2
B22: of:=[.B21]+1 -> 19 | C22: 1000 | D22: 5.5 | E22: 2
B23: of:=[.B22]+1 -> 20 | C23: 1000 | D23: 5.5 | E23: 2
B24: of:=[.B23]+1 -> 21 | C24: 1000 | D24: 5.5 | E24: 2
B25: of:=[.B24]+1 -> 22 | C25: 1000 | D25: 5.5 | E25: 2
B26: of:=[.B25]+1 -> 23 | C26: 1000 | D26: 5.5 | E26: 2
B27: of:=[.B26]+1 -> 24 | C27: 1000 | D27: 5.5 | E27: 2
B28: of:=[.B27]+1 -> 25 | C28: 1000 | D28: 5.5 | E28: 2
B29: of:=[.B28]+1 -> 26 | C29: 1000 | D29: 5.5 | E29: 2
B30: of:=[.B29]+1 -> 27 | C30: 1000 | D30: 5.5 | E30: 2
B31: of:=[.B30]+1 -> 28 | C31: 1000 | D31: 5.5 | E31: 2
B32: of:=[.B31]+1 -> 29 | C32: 1000 | D32: 5.5 | E32: 2
B33: of:=[.B32]+1 -> 30 | C33: 1000 | D33: 5.5 | E33: 2
B34: of:=[.B33]+1 -> 31 | C34: 1000 | D34: 5.5 | E34: 2
B35: of:=[.B34]+1 -> 32 | C35: 1000 | D35: 5.5 | E35: 2
B38: Tuning B
B39: Num | C39: Freq | D39: Gain | E39: Q
B40: 1 | C40: 1000 | D40: 5.5 | E40: 2.45
B41: of:=[.B40]+1 -> 2 | C41: 1000 | D41: 5.5 | E41: 2
B42: of:=[.B41]+1 -> 3 | C42: 1000 | D42: 5.5 | E42: 2
B43: of:=[.B42]+1 -> 4 | C43: 1000 | D43: 5.5 | E43: 2
B44: of:=[.B43]+1 -> 5 | C44: 1000 | D44: 5.5 | E44: 2
B45: of:=[.B44]+1 -> 6 | C45: 1000 | D45: 5.5 | E45: 2
B46: of:=[.B45]+1 -> 7 | C46: 1000 | D46: 5 | E46: 2
B47: of:=[.B46]+1 -> 8 | C47: 1000 | D47: 5.5 | E47: 2
B48: of:=[.B47]+1 -> 9 | C48: 1000 | D48: 5.5 | E48: 2
B49: of:=[.B48]+1 -> 10 | C49: 1000 | D49: 5.5 | E49: 2
B50: of:=[.B49]+1 -> 11 | C50: 1000 | D50: 5.5 | E50: 2
B51: of:=[.B50]+1 -> 12 | C51: 1000 | D51: 5.5 | E51: 2
B52: of:=[.B51]+1 -> 13 | C52: 1000 | D52: 5.5 | E52: 2
B53: of:=[.B52]+1 -> 14 | C53: 1000 | D53: 5.5 | E53: 2
B54: of:=[.B53]+1 -> 15 | C54: 1000 | D54: 5.5 | E54: 2
B55: of:=[.B54]+1 -> 16 | C55: 1000 | D55: 5.5 | E55: 2
B56: of:=[.B55]+1 -> 17 | C56: 1000 | D56: 5.5 | E56: 2
B57: of:=[.B56]+1 -> 18 | C57: 1000 | D57: 5.5 | E57: 2
B58: of:=[.B57]+1 -> 19 | C58: 1000 | D58: 5.5 | E58: 2
B59: of:=[.B58]+1 -> 20 | C59: 1000 | D59: 5.5 | E59: 2
B60: of:=[.B59]+1 -> 21 | C60: 1000 | D60: 5.5 | E60: 2
B61: of:=[.B60]+1 -> 22 | C61: 1000 | D61: 5.5 | E61: 2
B62: of:=[.B61]+1 -> 23 | C62: 1000 | D62: 5.5 | E62: 2
B63: of:=[.B62]+1 -> 24 | C63: 1000 | D63: 5.5 | E63: 2
B64: of:=[.B63]+1 -> 25 | C64: 1000 | D64: 5.5 | E64: 2
B65: of:=[.B64]+1 -> 26 | C65: 1000 | D65: 5.5 | E65: 2
B66: of:=[.B65]+1 -> 27 | C66: 1000 | D66: 5.5 | E66: 2
B67: of:=[.B66]+1 -> 28 | C67: 1000 | D67: 5.5 | E67: 2
B68: of:=[.B67]+1 -> 29 | C68: 1000 | D68: 5.5 | E68: 2
B69: of:=[.B68]+1 -> 30 | C69: 1000 | D69: 5.5 | E69: 2
B70: of:=[.B69]+1 -> 31 | C70: 1000 | D70: 5.5 | E70: 2
B71: of:=[.B70]+1 -> 32 | C71: 1000 | D71: 5.5 | E71: 2